{
  "schemaVersion": 1,
  "workflowId": "generic-image-smoke",
  "version": "1.0.0",
  "files": {
    "workflow.api.json": "03926039481c979b59bd4ad1006ced8ebdbb7d9a74cfe280cff85868722e1106",
    "manifest.json": "1a5ccab033002fa13a8acab70071162e531fc9e4aea2f17bbbf78beb282fe7cf",
    "compiled-bindings.json": "05daab9d6e2e074ea5748adde0234d6320460b42101dd31da5a708aaa3083c6d"
  },
  "environmentLockDigest": "sha256:1111111111111111111111111111111111111111111111111111111111111111"
}
